{
  "$schema": "https://json-schema.org/draft/2020-12/schema",
  "$id": "https://freelyforms.com/schema/form-v1.schema.json",
  "title": "Freely Forms form definition, schema version 1",
  "type": "object",
  "properties": {
    "schemaVersion": {
      "type": "number",
      "const": 1
    },
    "id": {
      "type": "string",
      "pattern": "^frm_[A-Za-z0-9]{6,32}$"
    },
    "title": {
      "type": "string",
      "minLength": 1,
      "maxLength": 200,
      "pattern": "\\S"
    },
    "description": {
      "type": "string",
      "maxLength": 5000
    },
    "settings": {
      "type": "object",
      "properties": {
        "submitLabel": {
          "type": "string",
          "minLength": 1,
          "maxLength": 60,
          "pattern": "\\S"
        },
        "success": {
          "type": "object",
          "properties": {
            "type": {
              "type": "string",
              "const": "message"
            },
            "message": {
              "type": "string",
              "minLength": 1,
              "maxLength": 2000,
              "pattern": "\\S"
            }
          },
          "required": [
            "type",
            "message"
          ],
          "additionalProperties": false
        }
      },
      "additionalProperties": false
    },
    "fields": {
      "maxItems": 200,
      "type": "array",
      "items": {
        "oneOf": [
          {
            "type": "object",
            "properties": {
              "type": {
                "type": "string",
                "const": "text"
              },
              "id": {
                "type": "string",
                "pattern": "^fld_[a-z0-9_]{1,48}$"
              },
              "label": {
                "type": "string",
                "minLength": 1,
                "maxLength": 500,
                "pattern": "\\S"
              },
              "description": {
                "type": "string",
                "maxLength": 2000
              },
              "required": {
                "type": "boolean"
              },
              "placeholder": {
                "type": "string",
                "maxLength": 200
              },
              "minLength": {
                "type": "integer",
                "minimum": 0,
                "maximum": 50000
              },
              "maxLength": {
                "type": "integer",
                "minimum": 1,
                "maximum": 50000
              }
            },
            "required": [
              "type",
              "id",
              "label"
            ],
            "additionalProperties": false
          },
          {
            "type": "object",
            "properties": {
              "type": {
                "type": "string",
                "const": "textarea"
              },
              "id": {
                "type": "string",
                "pattern": "^fld_[a-z0-9_]{1,48}$"
              },
              "label": {
                "type": "string",
                "minLength": 1,
                "maxLength": 500,
                "pattern": "\\S"
              },
              "description": {
                "type": "string",
                "maxLength": 2000
              },
              "required": {
                "type": "boolean"
              },
              "placeholder": {
                "type": "string",
                "maxLength": 200
              },
              "minLength": {
                "type": "integer",
                "minimum": 0,
                "maximum": 50000
              },
              "maxLength": {
                "type": "integer",
                "minimum": 1,
                "maximum": 50000
              }
            },
            "required": [
              "type",
              "id",
              "label"
            ],
            "additionalProperties": false
          },
          {
            "type": "object",
            "properties": {
              "type": {
                "type": "string",
                "const": "email"
              },
              "id": {
                "type": "string",
                "pattern": "^fld_[a-z0-9_]{1,48}$"
              },
              "label": {
                "type": "string",
                "minLength": 1,
                "maxLength": 500,
                "pattern": "\\S"
              },
              "description": {
                "type": "string",
                "maxLength": 2000
              },
              "required": {
                "type": "boolean"
              },
              "placeholder": {
                "type": "string",
                "maxLength": 200
              }
            },
            "required": [
              "type",
              "id",
              "label"
            ],
            "additionalProperties": false
          },
          {
            "type": "object",
            "properties": {
              "type": {
                "type": "string",
                "const": "phone"
              },
              "id": {
                "type": "string",
                "pattern": "^fld_[a-z0-9_]{1,48}$"
              },
              "label": {
                "type": "string",
                "minLength": 1,
                "maxLength": 500,
                "pattern": "\\S"
              },
              "description": {
                "type": "string",
                "maxLength": 2000
              },
              "required": {
                "type": "boolean"
              },
              "placeholder": {
                "type": "string",
                "maxLength": 200
              }
            },
            "required": [
              "type",
              "id",
              "label"
            ],
            "additionalProperties": false
          },
          {
            "type": "object",
            "properties": {
              "type": {
                "type": "string",
                "const": "number"
              },
              "id": {
                "type": "string",
                "pattern": "^fld_[a-z0-9_]{1,48}$"
              },
              "label": {
                "type": "string",
                "minLength": 1,
                "maxLength": 500,
                "pattern": "\\S"
              },
              "description": {
                "type": "string",
                "maxLength": 2000
              },
              "required": {
                "type": "boolean"
              },
              "placeholder": {
                "type": "string",
                "maxLength": 200
              },
              "min": {
                "type": "number"
              },
              "max": {
                "type": "number"
              },
              "integer": {
                "type": "boolean"
              }
            },
            "required": [
              "type",
              "id",
              "label"
            ],
            "additionalProperties": false
          },
          {
            "type": "object",
            "properties": {
              "type": {
                "type": "string",
                "const": "date"
              },
              "id": {
                "type": "string",
                "pattern": "^fld_[a-z0-9_]{1,48}$"
              },
              "label": {
                "type": "string",
                "minLength": 1,
                "maxLength": 500,
                "pattern": "\\S"
              },
              "description": {
                "type": "string",
                "maxLength": 2000
              },
              "required": {
                "type": "boolean"
              },
              "min": {
                "type": "string",
                "format": "date",
                "pattern": "^(?:(?:\\d\\d[2468][048]|\\d\\d[13579][26]|\\d\\d0[48]|[02468][048]00|[13579][26]00)-02-29|\\d{4}-(?:(?:0[13578]|1[02])-(?:0[1-9]|[12]\\d|3[01])|(?:0[469]|11)-(?:0[1-9]|[12]\\d|30)|(?:02)-(?:0[1-9]|1\\d|2[0-8])))$"
              },
              "max": {
                "type": "string",
                "format": "date",
                "pattern": "^(?:(?:\\d\\d[2468][048]|\\d\\d[13579][26]|\\d\\d0[48]|[02468][048]00|[13579][26]00)-02-29|\\d{4}-(?:(?:0[13578]|1[02])-(?:0[1-9]|[12]\\d|3[01])|(?:0[469]|11)-(?:0[1-9]|[12]\\d|30)|(?:02)-(?:0[1-9]|1\\d|2[0-8])))$"
              }
            },
            "required": [
              "type",
              "id",
              "label"
            ],
            "additionalProperties": false
          },
          {
            "type": "object",
            "properties": {
              "type": {
                "type": "string",
                "const": "select"
              },
              "id": {
                "type": "string",
                "pattern": "^fld_[a-z0-9_]{1,48}$"
              },
              "label": {
                "type": "string",
                "minLength": 1,
                "maxLength": 500,
                "pattern": "\\S"
              },
              "description": {
                "type": "string",
                "maxLength": 2000
              },
              "required": {
                "type": "boolean"
              },
              "options": {
                "minItems": 1,
                "maxItems": 500,
                "type": "array",
                "items": {
                  "type": "object",
                  "properties": {
                    "id": {
                      "type": "string",
                      "pattern": "^opt_[a-z0-9_]{1,48}$"
                    },
                    "label": {
                      "type": "string",
                      "minLength": 1,
                      "maxLength": 200,
                      "pattern": "\\S"
                    }
                  },
                  "required": [
                    "id",
                    "label"
                  ],
                  "additionalProperties": false
                }
              }
            },
            "required": [
              "type",
              "id",
              "label",
              "options"
            ],
            "additionalProperties": false
          },
          {
            "type": "object",
            "properties": {
              "type": {
                "type": "string",
                "const": "radio"
              },
              "id": {
                "type": "string",
                "pattern": "^fld_[a-z0-9_]{1,48}$"
              },
              "label": {
                "type": "string",
                "minLength": 1,
                "maxLength": 500,
                "pattern": "\\S"
              },
              "description": {
                "type": "string",
                "maxLength": 2000
              },
              "required": {
                "type": "boolean"
              },
              "options": {
                "minItems": 1,
                "maxItems": 500,
                "type": "array",
                "items": {
                  "type": "object",
                  "properties": {
                    "id": {
                      "type": "string",
                      "pattern": "^opt_[a-z0-9_]{1,48}$"
                    },
                    "label": {
                      "type": "string",
                      "minLength": 1,
                      "maxLength": 200,
                      "pattern": "\\S"
                    }
                  },
                  "required": [
                    "id",
                    "label"
                  ],
                  "additionalProperties": false
                }
              }
            },
            "required": [
              "type",
              "id",
              "label",
              "options"
            ],
            "additionalProperties": false
          },
          {
            "type": "object",
            "properties": {
              "type": {
                "type": "string",
                "const": "checkboxes"
              },
              "id": {
                "type": "string",
                "pattern": "^fld_[a-z0-9_]{1,48}$"
              },
              "label": {
                "type": "string",
                "minLength": 1,
                "maxLength": 500,
                "pattern": "\\S"
              },
              "description": {
                "type": "string",
                "maxLength": 2000
              },
              "required": {
                "type": "boolean"
              },
              "options": {
                "minItems": 1,
                "maxItems": 500,
                "type": "array",
                "items": {
                  "type": "object",
                  "properties": {
                    "id": {
                      "type": "string",
                      "pattern": "^opt_[a-z0-9_]{1,48}$"
                    },
                    "label": {
                      "type": "string",
                      "minLength": 1,
                      "maxLength": 200,
                      "pattern": "\\S"
                    }
                  },
                  "required": [
                    "id",
                    "label"
                  ],
                  "additionalProperties": false
                }
              },
              "minSelected": {
                "type": "integer",
                "minimum": 0,
                "maximum": 500
              },
              "maxSelected": {
                "type": "integer",
                "minimum": 1,
                "maximum": 500
              }
            },
            "required": [
              "type",
              "id",
              "label",
              "options"
            ],
            "additionalProperties": false
          },
          {
            "type": "object",
            "properties": {
              "type": {
                "type": "string",
                "const": "multiselect"
              },
              "id": {
                "type": "string",
                "pattern": "^fld_[a-z0-9_]{1,48}$"
              },
              "label": {
                "type": "string",
                "minLength": 1,
                "maxLength": 500,
                "pattern": "\\S"
              },
              "description": {
                "type": "string",
                "maxLength": 2000
              },
              "required": {
                "type": "boolean"
              },
              "options": {
                "minItems": 1,
                "maxItems": 500,
                "type": "array",
                "items": {
                  "type": "object",
                  "properties": {
                    "id": {
                      "type": "string",
                      "pattern": "^opt_[a-z0-9_]{1,48}$"
                    },
                    "label": {
                      "type": "string",
                      "minLength": 1,
                      "maxLength": 200,
                      "pattern": "\\S"
                    }
                  },
                  "required": [
                    "id",
                    "label"
                  ],
                  "additionalProperties": false
                }
              },
              "minSelected": {
                "type": "integer",
                "minimum": 0,
                "maximum": 500
              },
              "maxSelected": {
                "type": "integer",
                "minimum": 1,
                "maximum": 500
              }
            },
            "required": [
              "type",
              "id",
              "label",
              "options"
            ],
            "additionalProperties": false
          },
          {
            "type": "object",
            "properties": {
              "type": {
                "type": "string",
                "const": "consent"
              },
              "id": {
                "type": "string",
                "pattern": "^fld_[a-z0-9_]{1,48}$"
              },
              "label": {
                "type": "string",
                "minLength": 1,
                "maxLength": 500,
                "pattern": "\\S"
              },
              "description": {
                "type": "string",
                "maxLength": 2000
              },
              "required": {
                "type": "boolean"
              }
            },
            "required": [
              "type",
              "id",
              "label"
            ],
            "additionalProperties": false
          }
        ]
      }
    }
  },
  "required": [
    "schemaVersion",
    "id",
    "title",
    "fields"
  ],
  "additionalProperties": false
}
